{
  "schema_version": "1.0",
  "description": "欧州AI法 P23～P70の全条文データ",
  "created_at": "2025-11-04T13:59:51.597357",
  "articles": [
    {
      "article_id": "article_1",
      "article_number": "1条",
      "section_id": "3-2",
      "title_ja": "目的と範囲",
      "title_en": "Subject Matter",
      "slide_pages": [
        30
      ],
      "category": "scope",
      "risk_level": "general",
      "article_text": {
        "ja": "AIシステムの及ぼす、健康、安全、基本的権利、民主主義、順法、環境保護に対する悪影響からの保護とイノベーションを両立するために、人間中心で信頼できるAIを促進するための規則",
        "en": "Rules to promote human-centric and trustworthy AI to ensure protection against adverse impacts on health, safety, fundamental rights, democracy, rule of law and environmental protection"
      },
      "requirements": [
        {
          "req_id": "1-a",
          "type": "scope_definition",
          "description_ja": "EUでのAIシステムの投入と利用に関する、ハーモナイズした一連のルール",
          "description_en": "Harmonized rules on the placing on the market and use of AI systems in the EU",
          "sub_items": [],
          "conditions": "",
          "verification_method": "",
          "responsible_party": ""
        }
      ],
      "related_articles": [
        {
          "article_id": "article_2",
          "article_number": "2条",
          "relation_type": "related",
          "description": "適用範囲の詳細"
        },
        {
          "article_id": "article_5",
          "article_number": "5条",
          "relation_type": "references",
          "description": "禁止されるAI"
        }
      ],
      "related_recitals": [],
      "related_annexes": [],
      "notes": [],
      "visual_elements": {
        "has_flowchart": false,
        "has_diagram": false,
        "has_table": false,
        "elements": []
      },
      "metadata": {
        "created_at": "2025-11-04T13:57:47.219687",
        "updated_at": "2025-11-04T13:57:47.219698",
        "version": "1.0",
        "author": "AI法対応チーム",
        "status": "draft",
        "tags": [
          "目的",
          "範囲",
          "基本原則"
        ],
        "comments": []
      }
    },
    {
      "article_id": "article_2",
      "article_number": "2条",
      "section_id": "3-2",
      "title_ja": "適用範囲",
      "title_en": "Scope",
      "slide_pages": [
        31
      ],
      "category": "scope",
      "risk_level": "general",
      "article_text": {
        "ja": "本規則は、以下に適用される",
        "en": "This Regulation applies to"
      },
      "requirements": [
        {
          "req_id": "2-a",
          "type": "scope_definition",
          "description_ja": "Provider、deployerがEU域内でのAIシステム・サービス・GPAIモデルを提供する場合",
          "description_en": "Providers and deployers of AI systems and GPAI models within the EU",
          "sub_items": [],
          "conditions": "",
          "verification_method": "",
          "responsible_party": "provider, deployer"
        },
        {
          "req_id": "2-c",
          "type": "scope_definition",
          "description_ja": "EU域外で事業を行うprovider/developerであるが、AIの出力をEU域内で使う場合",
          "description_en": "Providers outside EU whose AI output is used within the EU",
          "sub_items": [],
          "conditions": "",
          "verification_method": "",
          "responsible_party": "provider"
        }
      ],
      "related_articles": [
        {
          "article_id": "article_1",
          "article_number": "1条",
          "relation_type": "related",
          "description": "本規則の目的"
        }
      ],
      "related_recitals": [],
      "related_annexes": [],
      "notes": [],
      "visual_elements": {
        "has_flowchart": false,
        "has_diagram": false,
        "has_table": false,
        "elements": []
      },
      "metadata": {
        "created_at": "2025-11-04T13:57:47.219702",
        "updated_at": "2025-11-04T13:57:47.219703",
        "version": "1.0",
        "author": "AI法対応チーム",
        "status": "draft",
        "tags": [
          "適用範囲",
          "Scope"
        ],
        "comments": []
      }
    },
    {
      "article_id": "article_3",
      "article_number": "3条",
      "section_id": "3-1",
      "title_ja": "定義",
      "title_en": "Definitions",
      "slide_pages": [
        26,
        27,
        28,
        29
      ],
      "category": "definition",
      "risk_level": "general",
      "article_text": {
        "ja": "本規則において、以下の定義を適用する",
        "en": "For the purposes of this Regulation, the following definitions apply"
      },
      "requirements": [
        {
          "req_id": "3-1",
          "type": "definition",
          "description_ja": "AIシステムの定義",
          "description_en": "AI System definition",
          "sub_items": [
            {
              "item_id": "3-1-detail",
              "description_ja": "さまざまなレベルの自律性で動作するように設計され、配備後に適応性を示す可能性があり、明示的または暗黙的な目的のために、物理的または仮想的な環境に影響を与えることができる予測、コンテンツ、推奨、または決定などの出力を生成する方法を、受け取った入力から推測する機械ベースのシステム",
              "description_en": "A machine-based system designed to operate with varying levels of autonomy..."
            }
          ],
          "conditions": "",
          "verification_method": "",
          "responsible_party": ""
        }
      ],
      "related_articles": [],
      "related_recitals": [],
      "related_annexes": [],
      "notes": [],
      "visual_elements": {
        "has_flowchart": false,
        "has_diagram": false,
        "has_table": false,
        "elements": []
      },
      "metadata": {
        "created_at": "2024-10-27T00:00:00Z",
        "updated_at": "2025-11-20T09:56:59.399Z",
        "version": "1.0",
        "author": "AI法対応チーム",
        "status": "draft",
        "tags": [
          "定義"
        ],
        "comments": []
      }
    },
    {
      "article_id": "article_4",
      "article_number": "4条",
      "section_id": "3-4",
      "title_ja": "AIリテラシー",
      "title_en": "AI Literacy",
      "slide_pages": [
        41
      ],
      "category": "obligation_provider",
      "risk_level": "general",
      "article_text": {
        "ja": "AIシステムの提供者と配備者は、スタッフやAIシステムの運用・使用に関わる他の人々に十分なレベルのAIリテラシーを確保するための措置を講じなければならない",
        "en": "Providers and deployers of AI systems shall take measures to ensure a sufficient level of AI literacy of their staff and other persons dealing with the operation and use of AI systems"
      },
      "requirements": [
        {
          "req_id": "4-1",
          "type": "mandatory",
          "description_ja": "スタッフに十分なレベルのAIリテラシーを確保",
          "description_en": "Ensure sufficient level of AI literacy of staff",
          "sub_items": [],
          "conditions": "AIシステムの提供者・配備者に適用",
          "verification_method": "トレーニング記録、理解度評価",
          "responsible_party": "provider, deployer"
        }
      ],
      "related_articles": [],
      "related_recitals": [],
      "related_annexes": [],
      "notes": [
        {
          "note_id": "note_4_1",
          "type": "explanation",
          "content_ja": "AIリテラシーとは、プロバイダー、配備者、影響を受ける人々が、本規則の文脈における権利と義務を考慮して、適切にAIシステムを解釈し使用できるようにするスキル、知識、理解を意味する",
          "content_en": "AI literacy means skills, knowledge and understanding that allow providers, deployers and affected persons to make an informed deployment of AI systems",
          "position": "全体"
        }
      ],
      "visual_elements": {
        "has_flowchart": false,
        "has_diagram": false,
        "has_table": false,
        "elements": []
      },
      "metadata": {
        "created_at": "2025-11-04T13:57:47.219707",
        "updated_at": "2025-11-04T13:57:47.219708",
        "version": "1.0",
        "author": "AI法対応チーム",
        "status": "draft",
        "tags": [
          "AIリテラシー",
          "教育",
          "トレーニング"
        ],
        "comments": []
      }
    },
    {
      "article_id": "article_5",
      "article_number": "5条",
      "section_id": "3-2",
      "title_ja": "禁止されるAI",
      "title_en": "Prohibited Artificial Intelligence Practices",
      "slide_pages": [
        32
      ],
      "category": "prohibition",
      "risk_level": "prohibited",
      "requirements": [
        {
          "req_id": "5-1-a",
          "type": "prohibition",
          "description_ja": "サブリミナルな手法に関するAI",
          "description_en": "AI systems that deploy subliminal techniques",
          "sub_items": [],
          "conditions": "EU域内での提供・使用",
          "verification_method": "システム機能レビュー",
          "responsible_party": "provider, deployer"
        },
        {
          "req_id": "5-1-b",
          "type": "prohibition",
          "description_ja": "特定の個人・集団の脆弱性を悪用するAI ",
          "description_en": "AI system that exploits any of the vulnerabilities of a natural person or a specific group of persons due to their age, disability or a specific social or economic situation, with the objective, or the effect, of materially distorting the behaviour of that person or a person belonging to that group in a manner that causes or is reasonably likely to cause that person or another person significant harm;",
          "sub_items": [],
          "conditions": "",
          "verification_method": "",
          "responsible_party": ""
        },
        {
          "req_id": "5-1-c",
          "type": "prohibition",
          "description_ja": "社会的スコアリングAI \n",
          "description_en": "AI systems for the evaluation or classification of natural persons or groups of persons over a certain period of time based on their social behaviour or known, inferred or predicted personal or personality characteristics, with the social score leading to either or both of the following:",
          "sub_items": [],
          "conditions": "",
          "verification_method": "",
          "responsible_party": ""
        },
        {
          "req_id": "5-1-d",
          "type": "prohibition",
          "description_ja": "プロファイリング等で犯罪リスクを評価・予測するAI ",